{
  "specVersion": "fwdslsh.dev/rabit/schemas/0.3.0/burrow",
  "kind": "burrow",
  "title": "Convention Demo - RFC 8615",
  "description": "Example burrow using RFC 8615 .well-known convention. Use this for enterprise environments with strict directory policies.",
  "updated": "2026-01-13T00:00:00Z",
  "entries": [
    {
      "id": "readme",
      "kind": "file",
      "uri": "../README.md",
      "title": "Convention Demo README",
      "summary": "Demonstrates the .well-known naming convention.",
      "mediaType": "text/markdown"
    }
  ]
}
