{
  "specVersion": "fwdslsh.dev/rabit/schemas/0.3.0/burrow",
  "kind": "burrow",
  "title": "Convention Demo - Non-dotfile",
  "description": "Example burrow using non-dotfile convention (burrow.json). Use this when web servers block dotfiles or for better visibility in file browsers.",
  "updated": "2026-01-13T00:00:00Z",
  "entries": [
    {
      "id": "readme",
      "kind": "file",
      "uri": "README.md",
      "title": "Convention Demo README",
      "summary": "Demonstrates the non-dotfile naming convention.",
      "mediaType": "text/markdown"
    }
  ]
}
