{
  "specVersion": "fwdslsh.dev/rabit/schemas/0.3.0/burrow",
  "kind": "burrow",
  "title": "RFC 8615 .well-known Example",
  "description": "Example burrow demonstrating the RFC 8615 .well-known convention for serving burrows with zero web server configuration.",
  "updated": "2026-01-13T00:00:00Z",
  "entries": [
    {
      "id": "readme",
      "kind": "file",
      "uri": "README.md",
      "title": "RFC 8615 .well-known Static Burrow Example",
      "summary": "Complete guide to using the .well-known convention for Rabit burrows.",
      "mediaType": "text/markdown",
      "priority": 100
    },
    {
      "id": "sample-doc",
      "kind": "file",
      "uri": "sample-document.md",
      "title": "Sample Document",
      "summary": "Example content file to demonstrate burrow structure.",
      "mediaType": "text/markdown",
      "priority": 80
    },
    {
      "id": "docker-compose",
      "kind": "file",
      "uri": "docker-compose.yml",
      "title": "Docker Compose Configuration",
      "summary": "Docker setup for serving this burrow.",
      "mediaType": "application/x-yaml",
      "priority": 60
    }
  ]
}
